{
  "problem_objective_alignment": {
    "status": "fail",
    "notes": "El objetivo general no evidencia alineacion suficiente con el problema planteado."
  },
  "objective_question_alignment": {
    "status": "pass",
    "notes": "Cada objetivo especifico tiene una pregunta de investigacion alineada y una matriz consistente."
  },
  "objective_method_alignment": {
    "status": "pass",
    "notes": "La metodologia propuesta y la matriz de consistencia muestran alineacion basica."
  },
  "population_method_alignment": {
    "status": "pass",
    "notes": "La poblacion y muestra mantienen coherencia con el enfoque descrito."
  },
  "technique_analysis_alignment": {
    "status": "pass",
    "notes": "Las tecnicas de recoleccion y el plan de analisis tienen una relacion razonable."
  },
  "citation_traceability": {
    "status": "pass",
    "notes": "Todas las referencias usadas pueden trazarse al set seleccionado."
  },
  "missing_information_flags": [],
  "risk_flags": [
    "Se usaron pocas referencias para sustentar el blueprint.",
    "Varias secciones del blueprint dependen mas del intake o assumptions que de soporte bibliografico directo."
  ]
}
